1. Installing postgresql in linux

  sudo apt install postgresql
  
  Starting postgres -----
  
viren@viren-SVE1511AENB:~$ sudo su postgres
postgres@viren-SVE1511AENB:/home/viren$ psql
psql (12.7 (Ubuntu 12.7-0ubuntu0.20.04.1))
Type "help" for help.

postgres=# 

  
  
2. Data types  :

Name	                      Storage Size               	           Description	                                           Range

smallint	                   2 bytes	                            small-range integer	                                -32768 to +32767

integer                    	4 bytes                              	typical choice for integer	                     -2147483648 to +2147483647

bigint	                    8 bytes	                               large-range integer	                      -9223372036854775808 to 9223372036854775807

decimal	                    variable                            	user-specified precision,exact	            up to 131072 digits before the decimal point;
                                                                                                              up to 16383 digits after the decimal point
                                                                                                              
numeric                   	variable	                            user-specified precision,exact	            up to 131072 digits before the decimal point;
                                                                                                              up to 16383 digits after the decimal point
                                                                                                              
real	                     4 bytes	                              variable-precision,inexact	                    6 decimal digits precision

double precision	         8 bytes	                              variable-precision,inexact	                    15 decimal digits precision

smallserial              	 2 bytes	                              small autoincrementing integer	                        1 to 32767

serial                     4 bytes                                	autoincrementing integer	                             1 to 2147483647

bigserial	                 8 bytes	                                large autoincrementing integer	                  1 to 9223372036854775807


3. to show all the list of databases in the postgresql

postgres=# \l
                             List of databases
   Name    |  Owner   | Encoding | Collate | Ctype |   Access privileges   
-----------+----------+----------+---------+-------+-----------------------
 postgres  | postgres | UTF8     | en_IN   | en_IN | 
 template0 | postgres | UTF8     | en_IN   | en_IN | =c/postgres          +
           |          |          |         |       | postgres=CTc/postgres
 template1 | postgres | UTF8     | en_IN   | en_IN | =c/postgres          +
           |          |          |         |       | postgres=CTc/postgres
(3 rows)

4. create database using 

postgres=# CREATE DATABASE admin;
CREATE DATABASE

5. to delete a databases using

postgres=# DROP DATABASE admin;
DROP DATABASE

6. for creating a table

postgres=# CREATE TABLE data (id integer, password varchar(25));
CREATE TABLE

for display table data 

postgres=# SELECT * from data;
 id | password 
----+----------
(0 rows)

7. insert data into table

postgres=# insert into data values(1,' virender');
INSERT 0 1

postgres=# SELECT * from data;
 id | password  
----+-----------
  1 |  virender
(1 row)

insert multiple data into table

postgres=# insert into data values(1,' virender'),(2,'sameer'),(3,'rizwan');
INSERT 0 3
postgres=# SELECT * from data;
 id | password  
----+-----------
  1 |  virender
  2 | sameer
  3 | rizwan
(4 rows)


8. modify the table 

postgres=# ALTER TABLE data ALTER  password type char(25);
ALTER TABLE

now password datatype change into varchar to char

9. for describe table 

postgres=# \d
        List of relations
 Schema | Name | Type  |  Owner   
--------+------+-------+----------
 public | data | table | postgres
(1 row)

postgres=# \d+
                      List of relations
 Schema | Name | Type  |  Owner   |    Size    | Description 
--------+------+-------+----------+------------+-------------
 public | data | table | postgres | 8192 bytes | 
(1 row)

10. how to alter column name 

postgres=# ALTER TABLE data RENAME password to name;
\ALTER TABLE

postgres=# SELECT * from data;
 id |           name            
----+---------------------------
  1 |  virender                
  1 |  virender                
  2 | sameer                   
  3 | rizwan                   
(4 rows)

11. delete rows from table

postgres=# DELETE from data WHERE id=1;
DELETE 2

postgres=# select * from data;
 id |           name            
----+---------------------------
  2 | sameer                   
  3 | rizwan                   
(2 rows)


12. creating the schema of table

postgres=# CREATE SCHEMA unknown;
\CREATE SCHEMA
postgres=# CREATE TABLE unknown.info (id integer, name varchar(25), address  varchar(50), mobile varchar(25));

postgres=# insert into unknown.info values(1,'virender','dabua colony faridabad',9654058335);
INSERT 0 1
postgres=# select * from unknown.info;
 id |   name   |        address         |   mobile   
----+----------+------------------------+------------ 
  1 | virender | dabua colony faridabad | 9654058335
(1 rows)


13. (A) PRIMARY KEY - A primary key is a column or a group of columns used to identify a row uniquely in a table.

    (B) FORIEGN KEY - A foreign key is a column or a group of columns in a table that reference the primary key of another table. It is used for joining two tables. 

    (C) UNIQUE KEY - UNIQUE constraint ensures that the uniqueness of the values entered into a column or a field of a table. 
    
    (D) NOT NULL - NOT NULL constraint for a column to enforce a column not accept NULL .
    
    
    postgres=# CREATE TABLE imp (no integer NOT NULL PRIMARY KEY , name varchar(25) NOT NULL, address varchar(50) NOT NULL, qualification varchar (25) NOT NULL);
    
    CREATE TABLE

    postgres=# \d imp;
                           Table "public.imp"
    
    Column     |         Type          | Collation | Nullable | Default 
---------------+-----------------------+-----------+----------+---------
 no            | integer               |           | not null | 
 name          | character varying(25) |           | not null | 
 address       | character varying(50) |           | not null | 
 qualification | character varying(25) |           | not null | 
Indexes:
    "imp_pkey" PRIMARY KEY, btree (no)

    
14. Subquery and nested queries  

postgres=# SELECT name FROM imp WHERE address ='dabua colony';
   name   
----------
 virender
(1 row)

15. MIN , MAX,  AVG 

postgres=# insert into cars values(1,'Ferarri', 2500000),(2,'lamborghini', 2900000),(3,'swift dezire', 500000), (4,'hundayi i20', 700000), (5,'creata', 2500000);
INSERT 0 5

postgres=# SELECT * from cars;
 id |     name     |  price  
----+--------------+---------
  1 | Ferarri      | 2500000
  2 | lamborghini  | 2900000
  3 | swift dezire | 500000
  4 | hundayi i20  | 700000
  5 | creata       | 2500000
(5 rows)

postgres=# SELECT  MAX(price) from cars;
  max   
--------
 700000
(1 row)

postgres=# SELECT  MIN(price) from cars;
   min   
---------
 2500000
(1 row)

postgres=# SELECT  AVG(price) from cars;
   avg   
---------
 1820000
(1 row)


